{
  "schema_version": "1.0.0",
  "layers": {
    "runtime": "runtime",
    "adapters": "adapters",
    "integrations": "integrations",
    "composition": "seoctl",
    "contracts": "contracts",
    "security": "security"
  },
  "allowed_layer_edges": [
    {"source": "composition", "target": "runtime"},
    {"source": "composition", "target": "adapters"},
    {"source": "composition", "target": "integrations"},
    {"source": "runtime", "target": "contracts"},
    {"source": "adapters", "target": "contracts"},
    {"source": "integrations", "target": "contracts"},
    {"source": "adapters", "target": "security"},
    {"source": "integrations", "target": "security"}
  ],
  "exceptions": [
    {"source":"runtime.llm","target":"security.pinned_http","owner":"Security owner","rationale":"Configured LLM endpoints delegate only to canonical vetted numeric public sockets with TLS hostname verification; retain a single transport seam during migration.","removal_phase":"P10"},
    {"source":"adapters.gsc_live_example","target":"integrations.google.client","owner":"Security owner","rationale":"The GSC example delegates OAuth and API traffic to the canonical bounded Google transport.","removal_phase":"P10"},
    {"source":"runtime.tools","target":"adapters.registry","owner":"Runtime architecture owner","rationale":"Legacy default composition remains available while explicit injection is supported.","removal_phase":"P10"},
    {"source":"adapters.google_pagespeed_live","target":"integrations.google.client","owner":"Runtime architecture owner","rationale":"Legacy PageSpeed adapter delegates to the shared authenticated Google transport.","removal_phase":"P10"},
    {"source":"adapters.rendered_page","target":"integrations.technical.http","owner":"Security owner","rationale":"Rendered raw fetch delegates to the canonical bounded every-hop public-web transport.","removal_phase":"P10"},
    {"source":"adapters.registry","target":"integrations.authority_media.adapters","owner":"Runtime architecture owner","rationale":"The legacy registry is the temporary default concrete-adapter composition root.","removal_phase":"P10"},
    {"source":"adapters.registry","target":"integrations.content_intelligence.adapters","owner":"Runtime architecture owner","rationale":"The legacy registry is the temporary default concrete-adapter composition root.","removal_phase":"P10"},
    {"source":"adapters.registry","target":"integrations.extensions","owner":"Runtime architecture owner","rationale":"The legacy registry is the temporary default concrete-adapter composition root.","removal_phase":"P10"},
    {"source":"adapters.registry","target":"integrations.google.crux","owner":"Runtime architecture owner","rationale":"The legacy registry is the temporary default concrete-adapter composition root.","removal_phase":"P10"},
    {"source":"adapters.registry","target":"integrations.google.ga4","owner":"Runtime architecture owner","rationale":"The legacy registry is the temporary default concrete-adapter composition root.","removal_phase":"P10"},
    {"source":"adapters.registry","target":"integrations.google.gsc","owner":"Runtime architecture owner","rationale":"The legacy registry is the temporary default concrete-adapter composition root.","removal_phase":"P10"},
    {"source":"adapters.registry","target":"integrations.google.sitemaps","owner":"Runtime architecture owner","rationale":"The legacy registry is the temporary default concrete-adapter composition root.","removal_phase":"P10"},
    {"source":"adapters.registry","target":"integrations.product_proof.adapters","owner":"Runtime architecture owner","rationale":"The legacy registry is the temporary default concrete-adapter composition root.","removal_phase":"P10"},
    {"source":"adapters.registry","target":"integrations.technical.adapters","owner":"Runtime architecture owner","rationale":"The legacy registry is the temporary default concrete-adapter composition root.","removal_phase":"P10"},
    {"source":"integrations.authority_media.drift","target":"adapters.evidence_store","owner":"Runtime architecture owner","rationale":"Authority drift reuses the bounded evidence persistence adapter during migration.","removal_phase":"P10"},
    {"source":"integrations.authority_media.drift","target":"adapters.page_drift","owner":"Runtime architecture owner","rationale":"Authority drift reuses the deterministic page-drift utility during migration.","removal_phase":"P10"},
    {"source":"integrations.authority_media.services","target":"adapters.evidence_store","owner":"Runtime architecture owner","rationale":"Authority services reuse bounded evidence persistence during migration.","removal_phase":"P10"},
    {"source":"integrations.extensions.providers","target":"adapters.mcp_extensions","owner":"Runtime architecture owner","rationale":"Provider facade delegates to the bounded MCP extension adapter during migration.","removal_phase":"P10"},
    {"source":"integrations.product_proof.service","target":"runtime.assets","owner":"Runtime architecture owner","rationale":"Product proof resolves versioned repository assets through the canonical resolver.","removal_phase":"P10"},
    {"source":"integrations.technical.inspection","target":"adapters.google_pagespeed_live","owner":"Runtime architecture owner","rationale":"Technical inspection delegates PageSpeed work to the bounded compatibility adapter.","removal_phase":"P10"}
  ],
  "network_modules": [
    "adapters/rendered_page.py",
    "security/url_safety.py",
    "security/pinned_http.py",
    "security/browser_proxy.py",
    "security/browser_capture.py",
    "integrations/authority_media/transport.py",
    "integrations/extensions/indexnow.py",
    "integrations/google/client.py",
    "integrations/technical/browser.py",
    "integrations/technical/http.py",
    "runtime/llm.py"
  ],
  "network_transports": {
    "adapters/rendered_page.py": {"policy":"PUBLIC_RENDERED_PAGE","delegates_to":"integrations.technical.http.BoundedHttpClient + security.url_safety.validate_public_url"},
    "security/url_safety.py": {"policy":"PUBLIC_URL_SAFETY","delegates_to":"security.url_safety.validate_public_url"},
    "security/pinned_http.py": {"policy":"VETTED_NUMERIC_HTTP_TLS","delegates_to":"security.url_safety.resolve_public_addresses"},
    "security/browser_proxy.py": {"policy":"BOUNDED_NUMERIC_BROWSER_EGRESS","delegates_to":"security.pinned_http.public_connection"},
    "security/browser_capture.py": {"policy":"ISOLATED_BROWSER_CONTEXT","delegates_to":"security.browser_proxy.BrowserEgress"},
    "integrations/authority_media/transport.py": {"policy":"APPROVED_HOST_BOUNDED_HTTP","delegates_to":"integrations.authority_media.transport.BoundedTransport"},
    "integrations/extensions/indexnow.py": {"policy":"NO_REDIRECT_PUBLIC_MUTATION","delegates_to":"integrations.extensions.indexnow.NoRedirect"},
    "integrations/google/client.py": {"policy":"GOOGLE_API_BOUNDED_HTTP","delegates_to":"integrations.google.client"},
    "integrations/technical/browser.py": {"policy":"PUBLIC_BROWSER_REQUEST_GUARD","delegates_to":"integrations.technical.browser"},
    "integrations/technical/http.py": {"policy":"PUBLIC_WEB_EVERY_HOP","delegates_to":"integrations.technical.http.BoundedHttpClient"},
    "runtime/llm.py": {"policy":"CONFIGURED_LLM_ENDPOINT_BOUNDED_HTTP","delegates_to":"runtime.llm"}
  }
}
